{
    "version": "v1.0.0",
    "entity": {
        "type": "individual",
        "role": "maintainer",
        "name": "The One (demo)",
        "email": "neo@example.com",
        "phone": "",
        "description": "I'm a developer interested in preserving digital freedoms and the decentralised and open nature of the internet. I like breaking down barriers in the cyberspace with FOSS technologies.\n\nSometimes I can't shake the feeling that the system we're living in isn't quite what it seems. That there is no spoon.\n\nPS: This is a dummy listing.",
        "webpageUrl": {
            "url": "https://example.com",
            "wellKnown": ""
        }
    },
    "projects": [{
        "guid": "zombo-app",
        "name": "Zombo App (demo)",
        "description": "The Zombo App is a database application that solves many problems and makes anything possible. Anything at all. Its possibilities are only limited by the user's own imagination.\n\nIt has been in active development for a decade and is used by millions of people worldwide. It is the next frontier.\n\nPS: This is a dummy demo listing.",
        "webpageUrl": {
            "url": "https://example.com/projects/zombo"
        },
        "repositoryUrl": {
            "url": "https://github.com/example/zombo-app",
            "wellKnown": "https://github.com/example/zombo-app/blob/main/.well-known/funding-manifest-urls"
        },
        "licenses": ["spdx:AGPL-3.0"],
        "tags": ["database", "columnar-database", "high-performance", "key-value-store"]
    },
    {
        "guid": "vb-gooey",
        "name": "VB Gooey IP tracer (demo)",
        "description": "Using quantum-entangled packet sniffers, this cutting-edge Visual Basic GUI IP Tracer employs hyper-threaded blockchain algorithms to decrypt the target's digital DNA signature. The system's neural network of overclocked RAM crystals generates a real-time holographic map of cyberspace, pinpointing the perp's location with nanosecond precision.\n\nIn addition, its turbo-encabulated flux capacitor and multi-dimensional firewall penetrator, allows any hyper-dimensional air-gapped network to be broken into with ease.\n\n\n\nPS: This is a dummy demo listing.",
        "webpageUrl": {
            "url": "https://vb-gooey-ip-tracer.net",
            "wellKnown": "https://vb-gooey-ip-tracer.net/.well-known/funding-manifest-urls"
        },
        "repositoryUrl": {
            "url": "https://github.com/example/vb-gooey-ip-tracer",
            "wellKnown": "https://github.com/example/vb-gooey-ip-tracer/blob/main/.well-known/funding-manifest-urls"
        },
        "licenses": ["spdx:MIT"],
        "tags": ["high-performance", "security", "gui", "networking"]
    }],
    "funding": {
        "channels": [
            {
                "guid": "mybank",
                "type": "bank",
                "address": "",
                "description": "Will accept direct bank transfers. Please e-mail me for details."
            },
            {
                "guid": "mypay",
                "type": "payment-provider",
                "address": "https://example.com/payme/@myid",
                "description": "Pay with your debit/credit card through this gateway and setup recurring subscriptions."
            }
        ],
        "plans": [
            {
                "guid": "hosting-monthly",
                "status": "active",
                "name": "Hosting support",
                "description": "This will cover the monthly server hosting costs for the projects.",
                "amount": 250,
                "currency": "USD",
                "frequency": "monthly",
                "channels": ["mypay"]
            },
            {
                "guid": "developer-time",
                "status": "active",
                "name": "Developer compensation",
                "description": "This will cover the cost of one developer working part-time on the projects.",
                "amount": 1000,
                "currency": "USD",
                "frequency": "monthly",
                "channels": ["mybank"]
            },
            {
                "guid": "angel-plan",
                "status": "active",
                "name": "Goodwill plan",
                "description": "Pay anything you wish to show your goodwill for the project.",
                "amount": 0,
                "currency": "USD",
                "frequency": "one-time",
                "channels": ["mybank", "mypay"]
            }
        ],
        "history": [
            {"year": 2020, "income": 10000, "expenses": 2000, "taxes": 200, "currency": "USD", "description": "Started accepting donations for the first time."},
            {"year": 2021, "income": 15000, "expenses": 5000, "taxes": 500, "currency": "USD", "description": ""},
            {"year": 2022, "income": 30000, "expenses": 10000, "taxes": 2000, "currency": "USD", "description": ""},
            {"year": 2023, "income": 25000, "expenses": 15000, "taxes": 1500, "currency": "USD", "description": "There was a dip, but we see this improving."}
        ]
    }
}
